{
  "id": "audit_b2c3d4e5",
  "timestamp": "2026-04-03T18:45:12.690Z",
  "event_type": "execution_complete",
  "actor": "agent_y5z6",
  "actor_context": {
    "agent_id": "agent_y5z6",
    "session_id": "sess_i9j0k1l2"
  },
  "capability_name": "orders.place",
  "capability_kind": "action",
  "execution_id": "exec_a1b2c3d4",
  "workflow_id": "wf_e5f6g7h8",
  "step_id": "step_place_order",
  "result": {
    "status": "success",
    "execution_time_ms": 234
  },
  "duration_ms": 234,
  "status": "success",
  "correlation_id": "corr_u1v2w3x4"
}
