{
  "id": "audit_c3d4e5f6",
  "timestamp": "2026-04-03T18:46:00.000Z",
  "event_type": "approval_decision_made",
  "actor": "human_operator_1",
  "actor_context": {
    "user_id": "human_operator_1",
    "session_id": "sess_i9j0k1l2",
    "ip_address": "192.168.1.1"
  },
  "capability_name": "payments.transfer",
  "capability_kind": "action",
  "approval_request_id": "appreq_d4e5f6g7",
  "approval_decision_id": "appdec_e5f6g7h8",
  "status": "success",
  "metadata": {
    "approval_reason": "Verified by operator",
    "channel": "web_console"
  },
  "tags": ["approval", "payment", "high_value"]
}
